{
  "schema": "quorum/1",
  "policy_version": "quorum-policy/1@2026-09-10+a722b93acf8ca66cf654c159f247a2c4",
  "attempt_id": "attempt:1bbc23bb0b29f3de54389a9d6cd12dcc",
  "artifact": {
    "kind": "git_commit",
    "commit": "fb2e409b3470be7b39cbebb3cc760f1c6089cb63",
    "digest": "sha256:79d7736b96fd5edca54a48d13351e944b4997691ec08ac4da30f05a3769a2f7d"
  },
  "producer": {
    "principal": "example:producer-e@example.invalid",
    "family": "claude",
    "family_trust": "observed",
    "key_id": "producer-e-observed"
  },
  "reviewer": {
    "principal": "example:reviewer-d@example.invalid",
    "family": "gemini",
    "family_trust": "observed",
    "key_id": "reviewer-d-gemini"
  },
  "review": {
    "verdict": "APPROVE",
    "pr": 42,
    "evidence_digest": "sha256:54ace6b65a47156a0631739bdd82ff24f10cccf85e2e5b72e2663860b900f0cb"
  },
  "signatures": {
    "producer": {
      "algorithm": "ed25519",
      "value": "pUX2ijD2rq2q0SphjPyPZHqJOo3k434X1OL82OnJUZKgnSteyA/BdZMJybg6AFkpI6SRXEInpEAmr80s/fVuBg=="
    },
    "reviewer": {
      "algorithm": "ed25519",
      "value": "vnvX29Qad3E63bkgbUUHMe+TnX8WPLpzuOgwjefCxrRGLkVEvj/dDXwYWNGiPDwqnqmDTEByHLQl4zcFXj9/Dg=="
    }
  }
}
