{
  "schema": "quorum/1",
  "policy_version": "quorum-policy/1@2026-09-28+53b8e0f885916f1bb0b3766d94b6c4fb",
  "attempt_id": "attempt:1bbc23bb0b29f3de54389a9d6cd12dcc",
  "artifact": {
    "kind": "git_commit",
    "commit": "fb2e409b3470be7b39cbebb3cc760f1c6089cb63",
    "digest": "sha256:79d7736b96fd5edca54a48d13351e944b4997691ec08ac4da30f05a3769a2f7d"
  },
  "producer": {
    "principal": "example:producer-a@example.invalid",
    "family": "claude",
    "family_trust": "declared",
    "key_id": "producer-a-claude"
  },
  "reviewer": {
    "principal": "example:reviewer-b@example.invalid",
    "family": "codex",
    "family_trust": "declared",
    "key_id": "reviewer-b-codex"
  },
  "review": {
    "verdict": "APPROVE",
    "pr": 42,
    "evidence_digest": "sha256:54ace6b65a47156a0631739bdd82ff24f10cccf85e2e5b72e2663860b900f0cb",
    "residue": {
      "undecided": [
        "whether the retry path can double-submit under a partitioned network"
      ],
      "refuted": [
        {
          "claim": "the digest comparison is timing-unsafe",
          "evidence": "timingSafeEqual is used at verify.mjs; a 10k-iteration timing run showed no separation"
        }
      ],
      "unsettled_by_execution": [
        "the CI audit job could not run: the Actions allowance was exhausted"
      ],
      "reviewer_limits": [
        "did not review the generated corpus; read only the four source files in the diff"
      ]
    }
  },
  "signatures": {
    "producer": {
      "algorithm": "ed25519",
      "value": "PFqqDucKInQmi7RlWTBN86yWkI497icDmuLIC0bCqbrxPMlVKnWOoi6cew/4xQO7E1h+XZQYyzgVSZJZXmqcBA=="
    },
    "reviewer": {
      "algorithm": "ed25519",
      "value": "rxhcFRw0kwlRM+RL2cjxeRB33I6f2JIdt8zF5zuuZn/ViS7ZvxdFQd8KMPpdqAKtOKr1OZShqGPwpagCDyPuCw=="
    }
  }
}
