{
  "schema": "quorum/1",
  "policy_version": "quorum-policy/1@2026-09-10+0a986e09c8d6e70bef8f795d68c967e9",
  "attempt_id": "attempt:1bbc23bb0b29f3de54389a9d6cd12dcc",
  "artifact": {
    "kind": "git_commit",
    "commit": "fb2e409b3470be7b39cbebb3cc760f1c6089cb63",
    "digest": "sha256:79d7736b96fd5edca54a48d13351e944b4997691ec08ac4da30f05a3769a2f7d"
  },
  "producer": {
    "principal": "example:producer-a@example.invalid",
    "family": "claude",
    "family_trust": "declared",
    "key_id": "producer-a-claude"
  },
  "reviewer": {
    "principal": "example:reviewer-b@example.invalid",
    "family": "codex",
    "family_trust": "declared",
    "key_id": "reviewer-b-codex"
  },
  "review": {
    "verdict": "APPROVE",
    "pr": null,
    "evidence_digest": "sha256:54ace6b65a47156a0631739bdd82ff24f10cccf85e2e5b72e2663860b900f0cb"
  },
  "signatures": {
    "producer": {
      "algorithm": "ed25519",
      "value": "JLa1QOD62k5a5Q7JaTM4PrUWwOg/0QxkPlyiX3lRFNq46hx/JmstEhP47zM0b1JZA7ZcI3i6sxUa3YYQ1w5LDg=="
    },
    "reviewer": {
      "algorithm": "ed25519",
      "value": "BEORJemNHdtg9Ixlql4Rvzs2j159xsPPPHMGvIL6GEXqRyASZN8SWZgbi0zc9dzuQ94T4nUkSJq11TPbLQelCw=="
    }
  }
}
